,titulo,titulo_original,ano,duracao,diretor,roteirista,elenco,nota,num_votos,sinopse,genero,verba,receita
953,Os Fantasmas se Divertem,Beetlejuice,1988,92,['Tim Burton'],"['Michael McDowell', 'Larry Wilson', 'Warren Skaaren']","['Alec Baldwin', 'Geena Davis', 'Michael Keaton']",7.5,392000.0,"Após morrerem em um acidente, Barbara e Adam se tornam fantasmas presos em sua casa. Quando uma família excêntrica se muda, eles contratam Beetlejuice, um espírito caótico, para expulsá-los. Lydia, que vê fantasmas, acaba complicando tudo.","['Comédia', 'Fantasia']",15000000,74852535
954,Túmulo dos Vagalumes,Hotaru no haka,1988,88,['Isao Takahata'],"['Akiyuki Nosaka', 'Isao Takahata']","['Tsutomu Tatsumi', 'Ayano Shiraishi', 'Akemi Yamaguchi']",8.5,330000.0,Um menino e sua irmã tentam sobreviver no Japão durante a Segunda Guerra Mundial.,"['Animação', 'Drama', 'Guerra']",3700000,801143
955,Cinema Paradiso,Nuovo Cinema Paradiso,1988,174,['Giuseppe Tornatore'],"['Giuseppe Tornatore', 'Vanna Paoli']","['Philippe Noiret', 'Enzo Cannavale', 'Antonella Attili']",8.5,292000.0,"Um diretor de cinema lembra como, em sua infância, ele se apaixonou pelo cinema de sua cidade e iniciou uma profunda amizade com o projecionista.","['Drama', 'Romance']",5000000,13020497
956,Quero ser Grande,Big,1988,104,['Penny Marshall'],"['Gary Ross', 'Anne Spielberg']","['Tom Hanks', 'Elizabeth Perkins', 'Robert Loggia']",7.3,246000.0,"Depois de desejar ser mais velho, um adolescente acorda na manhã seguinte para encontrar-se misteriosamente no corpo de um adulto.","['Comédia', 'Drama', 'Fantasia', 'Romance']",18000000,151927281
957,Um Príncipe em Nova York,Coming to America,1988,117,['John Landis'],"['Eddie Murphy', 'David Sheffield', 'Barry W. Blaustein']","['Eddie Murphy', 'Paul Bates', 'Garcelle Beauvais']",7.1,229000.0,"Um príncipe africano viaja para Queens, Nova York, e procura incógnito por uma esposa que ele possa respeitar por sua inteligência e vontade.","['Comédia', 'Romance']",30000000,288752301
958,Uma Cilada para Roger Rabbit,Who Framed Roger Rabbit,1988,104,['Robert Zemeckis'],"['Jeffrey Price', 'Peter S. Seaman', 'Gary K. Wolf']","['Bob Hoskins', 'Christopher Lloyd', 'Joanna Cassidy']",7.7,222000.0,Um detetive que odeia dibus deve defender o coelho animado mais popular quando ele é acusado de um crime que ele jura que não cometeu.,"['Animação', 'Aventura', 'Comédia', 'Policial', 'Família', 'Fantasia', 'Mistério']",70000000,329803958
959,Akira,Akira,1988,124,['Katsuhiro Ôtomo'],"['Katsuhiro Ôtomo', 'Izô Hashimoto']","['Mitsuo Iwata', 'Nozomu Sasaki', 'Mami Koyama']",8.0,211000.0,Um projeto militar põe em perigo a Tokyo.,"['Animação', 'Ação', 'Drama', 'Fantasia', 'Ficção científica', 'Suspense']",0,0
960,Corra Que a Polícia Vem Aí,The Naked Gun: From the Files of Police Squad!,1988,85,['David Zucker'],"['Jerry Zucker', 'Jim Abrahams', 'David Zucker']","['Leslie Nielsen', 'Priscilla Presley', 'O.J. Simpson']",7.6,190000.0,O incompetente detetive de polícia Frank Drebin deve frustrar uma tentativa de assassinato da rainha Elizabeth II.,"['Comédia', 'Policial']",12000000,78756177
961,Um Peixe Chamado Wanda,A Fish Called Wanda,1988,108,"['Charles Crichton', 'John Cleese']","['John Cleese', 'Charles Crichton']","['John Cleese', 'Jamie Lee Curtis', 'Kevin Kline']",7.5,157000.0,"Em Londres, quatro pessoas muito diferentes se juntam para cometer um assalto à mão armada e depois tentam se dobrar para o saque.","['Comédia', 'Policial']",7500000,62493712
962,Eles Vivem,They Live,1988,94,['John Carpenter'],"['Ray Nelson', 'John Carpenter']","['Roddy Piper', 'Keith David', 'Meg Foster']",7.2,151000.0,Um vagabundo descobre óculos escuros e descobre que alguns alienígenas tomaram a terra.,"['Ação', 'Terror', 'Ficção científica', 'Suspense']",4000000,13450603
963,Rambo 3,Rambo III,1988,102,['Peter MacDonald'],"['David Morrell', 'Sylvester Stallone', 'Sheldon Lettich']","['Sylvester Stallone', 'Richard Crenna', 'Marc de Jonge']",5.8,143000.0,Rambo embarca em uma missão de um homem para resgatar seu amigo coronel Trautman das garras das tropas invasoras soviéticas no Afeganistão.,"['Ação', 'Aventura', 'Suspense']",63000000,189015611
964,Irmãos Gêmeos,Twins,1988,107,['Ivan Reitman'],"['William Davies', 'William Osborne', 'Timothy Harris']","['Arnold Schwarzenegger', 'Danny DeVito', 'Kelly Preston']",6.2,140000.0,"Um homem fisicamente perfeito, mas inocente, vai em busca de seu irmão gêmeo perdido, que é baixo, mulherengo e ladrão.","['Comédia', 'Policial']",15000000,216614388
965,Willow: Na Terra da Magia,Willow,1988,126,['Ron Howard'],"['George Lucas', 'Bob Dolman']","['Val Kilmer', 'Joanne Whalley', 'Warwick Davis']",7.2,132000.0,Um jovem agricultor é escolhido para empreender uma perigosa jornada para proteger o bebê de uma rainha do mal.,"['Ação', 'Aventura', 'Drama', 'Fantasia', 'Romance']",35000000,57270852
966,Brinquedo Assassino,Child's Play,1988,87,['Tom Holland'],"['Don Mancini', 'John Lafia', 'Tom Holland']","['Catherine Hicks', 'Chris Sarandon', 'Alex Vincent']",6.7,122000.0,"Uma mãe solteira dá a seu filho o boneco mais desejado para o seu aniversário, mas eles descobrirão que ele é possuído pela alma de um assassino em série.","['Terror', 'Suspense']",9000000,44196684
967,Atração Mortal,Heathers,1988,103,['Michael Lehmann'],['Daniel Waters'],"['Winona Ryder', 'Christian Slater', 'Shannen Doherty']",7.1,120000.0,"Para sair da gangue que está destruindo sua reputação como uma boa menina, um adolescente inteligente se junta a um sociopata em um plano para matar os garotos.","['Comédia', 'Policial']",3000000,1166993
968,Os Fantasmas Contra Atacam,Scrooged,1988,101,['Richard Donner'],"['Mitch Glazer', ""Michael O'Donoghue"", 'Charles Dickens']","['Bill Murray', 'Karen Allen', 'John Forsythe']",6.9,118000.0,Um executivo de televisão egoísta e cínico é assombrado por três espíritos que dão aulas na véspera de Natal.,"['Comédia', 'Drama', 'Fantasia', 'Romance']",32000000,60329560
969,Mississippi em Chamas,Mississippi Burning,1988,128,['Alan Parker'],['Chris Gerolmo'],"['Gene Hackman', 'Willem Dafoe', 'Frances McDormand']",7.8,114000.0,Dois agentes do F.B.I. com estilos totalmente diferentes chegam ao Mississippi para investigar o desaparecimento de alguns ativistas dos direitos civis.,"['Policial', 'Drama', 'Mistério', 'Suspense']",15000000,34603943
970,Em Busca do Vale Encantado,The Land Before Time,1988,69,['Don Bluth'],"['Stu Krieger', 'Judy Freudberg', 'Tony Geiss']","['Pat Hingle', 'Gabriel Damon', 'Helen Shaver']",7.4,101000.0,Um brontossauro órfão se junta a outros jovens dinossauros para se reunir com suas famílias em um vale.,"['Animação', 'Aventura', 'Drama', 'Família']",12500000,84704291
971,Fuga à Meia-Noite,Midnight Run,1988,126,['Martin Brest'],['George Gallo'],"['Robert De Niro', 'Charles Grodin', 'Yaphet Kotto']",7.5,97000.0,"Um contador é perseguido por caçadores de recompensas, o F.B.I. e a Máfia após pular a fiança.","['Ação', 'Comédia', 'Policial', 'Suspense']",35000000,81613606
972,O Grande Dragão Branco,Bloodsport,1988,92,['Newt Arnold'],"['Sheldon Lettich', 'Christopher Cosby', 'Mel Friedman']","['Jean-Claude Van Damme', 'Donald Gibb', 'Leah Ayres']",6.8,97000.0,"Frank Dux, um artista marcial americano que atua no exército, que decide deixar o exército para competir em um torneio de artes marciais em Hong Kong, onde as lutas da morte podem ocorrer.","['Ação', 'Biografia', 'Drama', 'Esportes']",1100000,11807585
973,Cocktail,Cocktail,1988,104,['Roger Donaldson'],['Heywood Gould'],"['Tom Cruise', 'Bryan Brown', 'Elisabeth Shue']",5.9,94000.0,Um talentoso barman de Nova York arruma um emprego em um bar na Jamaica e se apaixona.,"['Comédia', 'Drama', 'Romance']",20000000,171504781
974,Os Safados,Dirty Rotten Scoundrels,1988,110,['Frank Oz'],"['Dale Launer', 'Stanley Shapiro', 'Paul Henning']","['Steve Martin', 'Michael Caine', 'Glenne Headly']",7.4,80000.0,Dois golpistas tentam resolver sua rivalidade apostando em quem pode enganar uma jovem herdeira americana com 50 mil dólares.,"['Comédia', 'Policial']",0,0
975,Indiana Jones e a Última Cruzada,Indiana Jones and the Last Crusade,1989,127,['Steven Spielberg'],"['Jeffrey Boam', 'George Lucas', 'Menno Meyjes']","['Harrison Ford', 'Sean Connery', 'Alison Doody']",8.2,825000.0,"Em 1938, depois que seu pai, o professor Henry Jones, desaparece enquanto persegue o Santo Graal, o professor Henry ""Indiana"" Jones, Jr. se encontra contra os nazistas de Adolf Hitler.","['Ação', 'Aventura']",48000000,474171806
976,De Volta para o Futuro 2,Back to the Future Part II,1989,108,['Robert Zemeckis'],"['Robert Zemeckis', 'Bob Gale']","['Michael J. Fox', 'Christopher Lloyd', 'Lea Thompson']",7.8,587000.0,"Depois de visitar 2015, Marty McFly retorna a 1955 para evitar as mudanças desastrosas de 1985, sem interferir na sua primeira viagem.","['Aventura', 'Comédia', 'Ficção científica']",40000000,332500002
977,Sociedade dos Poetas Mortos,Dead Poets Society,1989,128,['Peter Weir'],['Tom Schulman'],"['Robin Williams', 'Robert Sean Leonard', 'Ethan Hawke']",8.1,570000.0,O professor de Inglés John Keating inspira a seus estudantes a ver a poesia duma perspectiva diferente.,"['Comédia', 'Drama']",16400000,235860116
978,Batman,Batman,1989,126,['Tim Burton'],"['Bob Kane', 'Sam Hamm', 'Warren Skaaren']","['Michael Keaton', 'Jack Nicholson', 'Kim Basinger']",7.5,414000.0,"O cabaleiro da noite de Gotham comença sua guerra contra o crime com seu malhor enemigo, o Coringa.","['Ação', 'Aventura']",35000000,411569241
979,A Pequena Sereia,The Little Mermaid,1989,83,"['Ron Clements', 'John Musker']","['John Musker', 'Ron Clements', 'Hans Christian Andersen']","['Jodi Benson', 'Samuel E. Wright', 'Rene Auberjonois']",7.6,297000.0,Uma princesa sereia faz um acordo com uma bruxa inescrupulosa para encontrar um príncipe humano em terra.,"['Animação', 'Aventura', 'Família', 'Fantasia', 'Musical', 'Romance']",40000000,211343479
980,Harry e Sally: Feitos um para o Outro,When Harry Met Sally...,1989,95,['Rob Reiner'],['Nora Ephron'],"['Billy Crystal', 'Meg Ryan', 'Carrie Fisher']",7.7,249000.0,"Harry e Sally se conhecem há anos e são muito bons amigos, mas têm medo de que o sexo arruine a amizade.","['Comédia', 'Drama', 'Romance']",16000000,93275066
981,Os Caça-Fantasmas 2,Ghostbusters II,1989,108,['Ivan Reitman'],"['Dan Aykroyd', 'Harold Ramis']","['Bill Murray', 'Dan Aykroyd', 'Sigourney Weaver']",6.6,231000.0,"Peter Venkman, Ray Stantz e Egon Spengler pegam mais uma vez nos seus kits de protões para lutar contra as assombrações de Manhattan. Um antigo tirano prepara-se para voltar à Terra, usando o seu retrato no Museu de Arte.","['Ação', 'Comédia', 'Fantasia', 'Ficção científica']",25000000,215394738
982,Férias Frustradas de Natal,National Lampoon's Christmas Vacation,1989,97,['Jeremiah S. Chechik'],['John Hughes'],"['Chevy Chase', ""Beverly D'Angelo"", 'Juliette Lewis']",7.5,224000.0,"Como se esperava, os planos da família Griswold para um grande Natal familiar vão se transformar em um grande desastre.",['Comédia'],28000000,74540604
983,O Segredo do Abismo,The Abyss,1989,140,['James Cameron'],['James Cameron'],"['Ed Harris', 'Mary Elizabeth Mastrantonio', 'Michael Biehn']",7.5,198000.0,Uma equipe de mergulho civil se prepara para procurar um submarino nuclear perdido e enfrenta o perigo quando encontra uma espécie aquática alienígena.,"['Aventura', 'Drama', 'Mistério', 'Ficção científica', 'Suspense']",70000000,90520202
984,Máquina Mortífera 2,Lethal Weapon 2,1989,114,['Richard Donner'],"['Jeffrey Boam', 'Shane Black', 'Warren Murphy']","['Mel Gibson', 'Danny Glover', 'Joe Pesci']",7.3,193000.0,Riggs e Murtaugh estão no encalço de diplomatas sul-africanos que usam sua imunidade para participar de atividades criminosas.,"['Ação', 'Policial', 'Suspense']",28000000,227853986
985,O Serviço de Entregas da Kiki,Majo no takkyûbin,1989,103,['Hayao Miyazaki'],"['Eiko Kadono', 'Hayao Miyazaki']","['Kirsten Dunst', 'Minami Takayama', 'Rei Sakuma']",7.8,172000.0,"Uma jovem bruxa, em seu ano obrigatório de vida independente, acha difícil se adaptar a uma nova comunidade enquanto se apoia na administração de um serviço de correio aéreo.","['Animação', 'Família', 'Fantasia']",0,0
986,"Querida, Encolhi as Crianças","Honey, I Shrunk the Kids",1989,93,['Joe Johnston'],"['Stuart Gordon', 'Brian Yuzna', 'Ed Naha']","['Rick Moranis', 'Matt Frewer', 'Marcia Strassman']",6.4,170000.0,"O cientista Wayne Szalinsky constrói uma máquina que, acidentalmente, encolhe os seus filhos e os do vizinho, levando-os para um mundo cheio de perigos que normalmente não vemos bem a olho nu.","['Aventura', 'Comédia', 'Família', 'Ficção científica']",18000000,222724172
987,Tempo de Glória,Glory,1989,122,['Edward Zwick'],"['Kevin Jarre', 'Lincoln Kirstein', 'Peter Burchard']","['Matthew Broderick', 'Denzel Washington', 'Cary Elwes']",7.8,147000.0,"Robert Gould Shaw lidera a primeira empresa negra de voluntários da Guerra Civil dos Estados Unidos, e luta contra os preconceitos do Exército da União e dos Confederados.","['Biografia', 'Drama', 'História', 'Guerra']",18000000,26979166
988,Bill & Ted: Uma Aventura Fantástica,Bill & Ted's Excellent Adventure,1989,90,['Stephen Herek'],"['Chris Matheson', 'Ed Solomon']","['Keanu Reeves', 'Alex Winter', 'George Carlin']",6.9,144000.0,"Os amigos Bill e Ted podem ser reprovados em História. Eles recebem ajuda de um homem vindo do futuro e viajam através do passado, encontrando figuras como Napoleão, Sócrates e Gengis Khan, o que os ajuda a fazer o trabalho final.","['Aventura', 'Comédia', 'Musical', 'Romance', 'Ficção científica']",8500000,40510984
989,Campo dos Sonhos,Field of Dreams,1989,107,['Phil Alden Robinson'],"['W.P. Kinsella', 'Phil Alden Robinson']","['Kevin Costner', 'James Earl Jones', 'Ray Liotta']",7.5,132000.0,"Um fazendeiro de milho de Iowa, ouvindo vozes, as interpreta como uma ordem para construir um diamante de beisebol em seus campos; ele o faz, e em resposta, recebe uma visita dos Chicago White Sox de 1919.","['Drama', 'Família', 'Fantasia', 'Esportes']",15000000,84431625
990,Conduzindo Miss Daisy,Driving Miss Daisy,1989,99,['Bruce Beresford'],['Alfred Uhry'],"['Morgan Freeman', 'Jessica Tandy', 'Dan Aykroyd']",7.3,119000.0,Uma velha judia e seu chofer afro-americano no sul dos Estados Unidos têm um relacionamento que cresce e melhora com o passar dos anos.,"['Comédia', 'Drama']",7500000,145793296
991,Nascido em 4 de Julho,Born on the Fourth of July,1989,145,['Oliver Stone'],"['Ron Kovic', 'Oliver Stone']","['Tom Cruise', 'Bryan Larkin', 'Raymond J. Barry']",7.2,119000.0,"A biografia de Ron Kovic. Paralisado na guerra do Vietnã, ele se torna num ativista político anti-guerra e pró-direitos humanos.","['Biografia', 'Drama', 'Guerra']",14000000,161001698
992,Cemitério Maldito,Pet Sematary,1989,103,['Mary Lambert'],['Stephen King'],"['Dale Midkiff', 'Denise Crosby', 'Fred Gwynne']",6.5,118000.0,"Após a tragédia, um pai de luto descobre um antigo cemitério atrás de sua casa com o poder de ressuscitar os mortos.","['Fantasia', 'Terror', 'Suspense']",11500000,57470138
993,Tango e Cash: Os Vingadores,Tango & Cash,1989,104,"['Andrey Konchalovskiy', 'Albert Magnoli']",['Randy Feldman'],"['Sylvester Stallone', 'Kurt Russell', 'Teri Hatcher']",6.4,116000.0,"Emoldurado por seu implacável arqui-inimigo, uma dupla de combate ao crime que não combina tem que deixar de lado suas diferenças para igualar a pontuação com o rei do mal que as colocou atrás das grades de uma vez por todas.","['Ação', 'Comédia', 'Policial', 'Suspense']",55000000,63408614
994,Faça a Coisa Certa,Do the Right Thing,0,0,['Spike Lee'],['Spike Lee'],"['Danny Aiello', 'Ossie Davis', 'Ruby Dee']",7.9,116000.0,"No dia mais quente do ano, as tensões crescem em um setor do Brooklyn para explodir em violência.","['Comédia', 'Drama']",6500000,37295445
995,007 - Permissão para Matar,Licence to Kill,1989,133,['John Glen'],"['Michael G. Wilson', 'Richard Maibaum', 'Ian Fleming']","['Timothy Dalton', 'Robert Davi', 'Carey Lowell']",6.7,114000.0,"Quando o traficante Franz Sanchez mata o agente da CIA Felix Leiter, Bond vai atrás dele. Mas após receber ordens de Londres para parar, Bond vai ter de escolher entre a lealdade a um amigo e a lealdade ao seu país e ao serviço secreto.","['Ação', 'Aventura', 'Suspense']",32000000,156167015
996,Quem Vê Cara Não Vê Coração,Uncle Buck,1989,100,['John Hughes'],['John Hughes'],"['John Candy', 'Macaulay Culkin', 'Jean Louisa Kelly']",7.1,111000.0,O solteiro e preguiçoso Buck cuida da filha adolescente de seu irmão e também de seus dois irmãos mais novos.,['Comédia'],15000000,79258538
997,Matador de Aluguel,Road House,1989,114,['Rowdy Herrington'],"['R. Lance Hill', 'Hilary Henkin']","['Patrick Swayze', 'Kelly Lynch', 'Sam Elliott']",6.7,105000.0,Um segurança durão é contratado para domar um bar barra pesada.,"['Ação', 'Suspense']",17000000,30052173
998,Digam o que Quiserem,Say Anything...,1989,100,['Cameron Crowe'],['Cameron Crowe'],"['John Cusack', 'Ione Skye', 'John Mahoney']",7.3,98000.0,Um nobre fracassado e uma bela oradora se apaixonam no verão antes que ela vá para a faculdade.,"['Comédia', 'Drama', 'Romance']",0,0
999,Olha Quem Está Falando,Look Who's Talking,1989,93,['Amy Heckerling'],['Amy Heckerling'],"['John Travolta', 'Kirstie Alley', 'Olympia Dukakis']",5.9,88000.0,"Depois que uma mulher solteira e com uma carreira é deixada sozinha para dar à luz o filho de um homem casado, ela encontra uma chance romântica em um taxista. Enquanto isso, o ponto de vista do menino é narrado através da dublagem.",['Comédia'],7500000,296999813
1000,Os Bons Companheiros,Goodfellas,1990,145,['Martin Scorsese'],"['Nicholas Pileggi', 'Martin Scorsese']","['Robert De Niro', 'Ray Liotta', 'Joe Pesci']",8.7,1300000.0,"A historia do Henry Hill e sua vida na máfia, sua relação com sua esposa Karen Hill e seus colegas da máfia Jimmy Conway e Tommy DeVito no sindicato italo-americano do crime.","['Biografia', 'Policial', 'Drama']",25000000,47054352
1001,Esqueceram de Mim,Home Alone,1990,103,['Chris Columbus'],['John Hughes'],"['Macaulay Culkin', 'Joe Pesci', 'Daniel Stern']",7.7,669000.0,"Quando seus pais viajaram e o esqueceram sozinho em casa, Kevin pensou que tudo seria uma maravilha. Até que ele se viu forçado a ser o homem da casa, defendendo-a de invasores inesperados e atrapalhados.","['Comédia', 'Família']",18000000,476684675
1002,Edward Mãos de Tesoura,Edward Scissorhands,1990,105,['Tim Burton'],"['Tim Burton', 'Caroline Thompson']","['Johnny Depp', 'Winona Ryder', 'Dianne Wiest']",7.9,538000.0,"Um homem artificial, que foi construído de forma incompleta e tem uma tesoura em vez de mãos, leva uma vida solitária, mas está prestes a começar uma nova vida.","['Drama', 'Fantasia', 'Romance']",20000000,86024005
1003,De Volta para o Futuro 3,Back to the Future Part III,1990,118,['Robert Zemeckis'],"['Robert Zemeckis', 'Bob Gale']","['Michael J. Fox', 'Christopher Lloyd', 'Mary Steenburgen']",7.4,492000.0,"Preso em 1955, Marty McFly descobre a morte de Doc Brown em 1885 e deve viajar de volta no tempo para salvá-lo. Sem combustível disponível, os dois devem descobrir como escapar do Velho Oeste antes que Emmett seja assassinado.","['Aventura', 'Comédia', 'Ficção científica', 'Faroeste']",40000000,245077583
1004,O Poderoso Chefão: Parte III,The Godfather Part III,1990,162,['Francis Ford Coppola'],"['Mario Puzo', 'Francis Ford Coppola']","['Al Pacino', 'Diane Keaton', 'Andy Garcia']",7.6,432000.0,"No meio de tentar legitimar seus negócios na cidade de Nova York e na Itália em 1979, o velho mafioso Don Michael Corleone procura confessar seus pecados, enquanto tomava seu sobrinho Vincent Mancini baixo sua proteção.","['Policial', 'Drama']",54000000,136861392
1005,Duro de Matar 2,Die Hard 2,1990,124,['Renny Harlin'],"['Steven E. de Souza', 'Doug Richardson', 'Walter Wager']","['Bruce Willis', 'William Atherton', 'Bonnie Bedelia']",7.1,389000.0,"John McClane tenta evitar o desastre enquanto agentes militares desonestos assumem o controle do Aeroporto Internacional de Dulles em Washington, DC","['Ação', 'Suspense']",70000000,240031274
1006,Uma Linda Mulher,Pretty Woman,1990,119,['Garry Marshall'],['J.F. Lawton'],"['Richard Gere', 'Julia Roberts', 'Jason Alexander']",7.1,376000.0,"Um homem de negócios contrata uma prostituta para acompanhá-lo a eventos sociais, mas se apaixona por ela.","['Comédia', 'Romance']",14000000,463406268
1007,O Vingador do Futuro,Total Recall,1990,113,['Paul Verhoeven'],"['Philip K. Dick', 'Ronald Shusett', ""Dan O'Bannon""]","['Arnold Schwarzenegger', 'Sharon Stone', 'Michael Ironside']",7.5,362000.0,"Quando um homem va virtualemente de férias em Marte, uma série de acontecimentos faz que ele viaje ao planeta de verdade o não.","['Ação', 'Aventura', 'Ficção científica']",65000000,261317921
1008,Dança com Lobos,Dances with Wolves,1990,181,['Kevin Costner'],['Michael Blake'],"['Kevin Costner', 'Mary McDonnell', 'Graham Greene']",8.0,297000.0,"O tenente John Dunbar, designado para um posto remoto da Guerra Civil, faz amizade com lobos e índios, se tornando intolerável nas forças armadas.","['Aventura', 'Drama', 'Faroeste']",22000000,424208848
1009,Louca Obsessão,Misery,1990,107,['Rob Reiner'],"['Stephen King', 'William Goldman']","['James Caan', 'Kathy Bates', 'Richard Farnsworth']",7.8,244000.0,"Um famoso autor sofre um acidente de carro e é resgatado por uma fã, mas logo percebe que sua vida ainda está em risco.","['Drama', 'Suspense']",20000000,61277597
1010,Ghost: Do Outro Lado da Vida,Ghost,1990,127,['Jerry Zucker'],['Bruce Joel Rubin'],"['Patrick Swayze', 'Demi Moore', 'Whoopi Goldberg']",7.1,242000.0,"Um homem é morto e seu espírito é deixado para trás. Com a ajuda de uma médium, ele tenta avisar sua amante do perigo que se aproxima.","['Drama', 'Fantasia', 'Romance', 'Suspense']",22000000,505703557
1011,A Caçada ao Outubro Vermelho,The Hunt for Red October,1990,135,['John McTiernan'],"['Tom Clancy', 'Larry Ferguson', 'Donald E. Stewart']","['Sean Connery', 'Alec Baldwin', 'Scott Glenn']",7.5,219000.0,"Em 1984, Markus Ramius, capitão do submarino soviético Outubro Vermelho, desobedece a ordens e segue rumo aos Estados Unidos. Com o comando russo atrás dele, os americanos tentarão descobrir quais as reais intenções de Ramius.","['Ação', 'Aventura', 'Suspense']",30000000,200512643
1012,O Predador 2: A Caçada Continua,Predator 2,1990,108,['Stephen Hopkins'],"['Jim Thomas', 'John Thomas']","['Danny Glover', 'Gary Busey', 'Kevin Peter Hall']",6.3,188000.0,"O Predador retorna à Terra, esta vez para retomar as ruas de Los Angeles, desertas pela guerra.","['Ação', 'Terror', 'Ficção científica']",30000000,57120318
1013,Um Tira no Jardim de Infância,Kindergarten Cop,1990,111,['Ivan Reitman'],"['Murray Salem', 'Herschel Weingrod', 'Timothy Harris']","['Arnold Schwarzenegger', 'Penelope Ann Miller', 'Pamela Reed']",6.2,166000.0,"Um policial durão deve se passar por um professor de jardim de infância para localizar a ex-esposa de um criminoso perigoso, que pode ter a chave para colocá-lo atrás das grades.","['Ação', 'Comédia', 'Policial']",15000000,201957688
1014,Tempo de Despertar,Awakenings,1990,121,['Penny Marshall'],"['Oliver Sacks', 'Steven Zaillian']","['Robert De Niro', 'Robin Williams', 'Julie Kavner']",7.8,163000.0,"As vítimas de uma epidemia de encefalite são catatônicas, mas um novo medicamento oferece a possibilidade de ajudá-las.","['Biografia', 'Drama']",31000000,52096475
1015,O Ataque dos Vermes Malditos,Tremors,1990,96,['Ron Underwood'],"['S.S. Wilson', 'Brent Maddock', 'Ron Underwood']","['Kevin Bacon', 'Fred Ward', 'Finn Carter']",7.2,156000.0,Os nativos de uma pequena cidade isolada se defendem de estranhas criaturas subterrâneas que os estão matando um por um.,"['Comédia', 'Terror']",11000000,16668790
1016,Rocky V,Rocky V,1990,104,['John G. Avildsen'],['Sylvester Stallone'],"['Sylvester Stallone', 'Talia Shire', 'Burt Young']",5.4,154000.0,"Aposentado da luta contra sua vontade, Rocky assume o ginásio de Mickey e concorda em treinar um jovem protegido que está faminto de sucesso.","['Drama', 'Esportes']",42000000,119946358
1017,Ajuste Final,Miller's Crossing,1990,115,"['Joel Coen', 'Ethan Coen']","['Joel Coen', 'Ethan Coen', 'Dashiell Hammett']","['Gabriel Byrne', 'Albert Finney', 'John Turturro']",7.7,144000.0,"Leo é um velho gangster irlandês e tem Tom Reagan por seu braço-direito. Mas o império criminal começa a ruir ao descobrir que Tom está envolvido com a sua mulher. Porém, ele vai tentar evitar uma guerra contra o gangue de Johnny Caspar.","['Policial', 'Drama', 'Suspense']",14000000,5080409
1018,Alucinações do Passado,Jacob's Ladder,1990,113,['Adrian Lyne'],['Bruce Joel Rubin'],"['Tim Robbins', 'Elizabeth Peña', 'Danny Aiello']",7.4,121000.0,"De luto por seu filho morto, um veterano da Guerra do Vietnã tenta descobrir seu passado enquanto sofre de um caso de desassociação. Para isso, deve decifrar a realidade e a vida a partir de seus sonhos, ilusões e percepções da morte.","['Drama', 'Terror', 'Mistério']",25000000,26118851
1019,Gremlins 2: A Nova Geração,Gremlins 2: The New Batch,1990,106,"['Joe Dante', 'Chuck Jones']","['Charles S. Haas', 'Chris Columbus']","['Zach Galligan', 'Phoebe Cates', 'Howie Mandel']",6.4,115000.0,"Após a morte do Sr. Wing, Gizmo é levado por um cientista mas Billy e Kate logo o reencontram. Porém, durante um jantar, o mogwai é acidentalmente molhado, dando origem a quatro novos animais que, rapidamente, se tornarão Gremlins.","['Comédia', 'Fantasia', 'Terror']",50000000,41483050
