,titulo,titulo_original,ano,duracao,diretor,roteirista,elenco,nota,num_votos,sinopse,genero,verba,receita
483,Um Assaltante Bem Trapalhão,Take the Money and Run,1969,85,['Woody Allen'],"['Woody Allen', 'Mickey Rose']","['Woody Allen', 'Janet Margolin', 'Marcel Hillaire']",7.2,32000.0,"The life and times of Virgil Starkwell, inept bank robber.","['Comédia', 'Policial']",0,0
484,O Exército das Sombras,L'armée des ombres,1969,145,['Jean-Pierre Melville'],"['Joseph Kessel', 'Jean-Pierre Melville']","['Lino Ventura', 'Paul Meurisse', 'Jean-Pierre Cassel']",8.1,27000.0,Um relato sobre combatentes clandestinos da resistência na França ocupada pelos nazistas.,"['Drama', 'Guerra']",0,0
485,A Batalha da Grã-Bretanha,Battle of Britain,1969,132,['Guy Hamilton'],"['James Kennaway', 'Wilfred Greatorex', 'Derek Dempster']","['Michael Caine', 'Trevor Howard', 'Harry Andrews']",6.9,25000.0,"Em 1940, a Força Aérea Real Britânica trava uma batalha desesperada para impedir que a Luftwaffe ganhe superioridade aérea sobre o Canal da Mancha como prelúdio para uma possível invasão do eixo do Reino Unido.","['Ação', 'Drama', 'História', 'Guerra']",17000000,2723
486,Kes,Kes,1969,111,['Ken Loach'],"['Barry Hines', 'Ken Loach', 'Tony Garnett']","['David Bradley', 'Brian Glover', 'Freddie Fletcher']",7.9,24000.0,Um jovem inglês da classe trabalhadora passa seu tempo livre cuidando e treinando seu falcão de estimação.,"['Drama', 'Família']",0,0
487,A Noite dos Desesperados,"They Shoot Horses, Don't They?",1969,129,['Sydney Pollack'],"['Horace McCoy', 'James Poe', 'Robert E. Thompson']","['Jane Fonda', 'Michael Sarrazin', 'Susannah York']",7.8,21000.0,As vidas de um distinto grupo de competidores se mistura com uma maratona de dança desumanamente cansativa.,['Drama'],0,0
488,Topázio,Topaz,1969,143,['Alfred Hitchcock'],"['Leon Uris', 'Samuel A. Taylor']","['Frederick Stafford', 'Dany Robin', 'John Vernon']",6.2,20000.0,"Um agente de inteligência francês se envolve na política da Guerra Fria primeiro descobrindo os eventos que levaram à Crise dos Mísseis Cubanos de 1962, e depois volta à França para desmantelar uma rede internacional de espiões russos.","['Drama', 'Suspense']",4000000,88
489,Se Meu Fusca Falasse,The Love Bug,1969,108,['Robert Stevenson'],"['Bill Walsh', 'Don DaGradi', 'Gordon Buford']","['Dean Jones', 'Michele Lee', 'David Tomlinson']",6.5,18000.0,Um piloto de corridas se torna um campeão com um Volkswagen Beetle com mente própria.,"['Comédia', 'Família', 'Esportes']",0,0
490,Satyricon de Fellini,Fellini - Satyricon,1969,129,['Federico Fellini'],"['Petronius', 'Federico Fellini', 'Bernardino Zapponi']","['Martin Potter', 'Hiram Keller', 'Max Born']",6.8,17000.0,"Uma série de contos míticos sem ligação, ambientados em Roma do século I.","['Drama', 'Fantasia']",3000000,1138108
491,"Alô, Dolly!","Hello, Dolly!",1969,146,['Gene Kelly'],"['Michael Stewart', 'Thornton Wilder', 'Ernest Lehman']","['Barbra Streisand', 'Walter Matthau', 'Michael Crawford']",7.0,17000.0,"A casamenteira Dolly Levi viaja para Yonkers para encontrar um parceiro para o ""meio-milionário"" Horace Vandergelder, e convence sua sobrinha, o noivo de sua sobrinha e seus dois funcionários a viajar para Nova York no caminho.","['Aventura', 'Comédia', 'Musical', 'Romance']",25000000,403127
492,Braço de Diamante,Brilliantovaya ruka,1969,94,['Leonid Gaidai'],"['Leonid Gaidai', 'Yakov Kostyukovskiy', 'Moris Slobodskoy']","['Yuriy Nikulin', 'Nina Grebeshkova', 'Andrey Mironov']",8.3,17000.0,An ordinary Soviet citizen accidentally intervenes into a huge operation of international criminal group that trades illegally obtained jewelry.,"['Aventura', 'Comédia', 'Policial']",0,0
493,Os Aventureiros do Ouro,Paint Your Wagon,1969,164,['Joshua Logan'],"['Alan Jay Lerner', 'Paddy Chayefsky']","['Lee Marvin', 'Clint Eastwood', 'Jean Seberg']",6.6,15000.0,"Dois improváveis parceiros de prospecção dividem a mesma esposa em uma cidade mineradora da Califórnia, onde há corrida pelo ouro.","['Comédia', 'Drama', 'Musical', 'Romance', 'Faroeste']",20000000,14500000
494,Minha Noite Com Ela,Ma nuit chez Maud,1969,110,['Éric Rohmer'],['Éric Rohmer'],"['Jean-Louis Trintignant', 'Françoise Fabian', 'Marie-Christine Barrault']",7.8,15000.0,"Os princípios rígidos de um católico devoto são desafiados durante uma estadia de uma noite com Maud, uma mulher divorciada com uma enorme personalidade.","['Comédia', 'Drama', 'Romance']",0,0
495,A Cor da Romã,Sayat Nova,1969,79,['Sergei Parajanov'],"['Sayat Nova', 'Sergei Parajanov']","['Sofiko Chiaureli', 'Melkon Alekyan', 'Vilen Galstyan']",7.6,14000.0,"A vida do poeta arménio Sayat-Nova, desde a infância até à morte, o seu percurso espiritual, esforços artísticos e conflitos internos no contexto cultural e histórico da Arménia, aclamado como revolucionário por Mikhail Vartanov.","['Biografia', 'Drama', 'História', 'Musical']",0,0
496,A Piscina,La piscine,1969,122,['Jacques Deray'],"['Alain Page', 'Jean-Claude Carrière', 'Jacques Deray']","['Alain Delon', 'Romy Schneider', 'Maurice Ronet']",7.1,14000.0,"Os amantes Marianne e Jean-Paul passam as férias em uma vila na Riviera francesa, perto de Saint-Tropez. Marianne convida seu ex-amante, Harry, e sua filha adolescente a ficar. A tensão aumenta quando Jean-Paul seduz Penélope.","['Policial', 'Drama', 'Romance']",0,0
497,Uma Cidade Contra o Xerife,Support Your Local Sheriff!,1969,92,['Burt Kennedy'],['William Bowers'],"['James Garner', 'Joan Hackett', 'Walter Brennan']",7.5,13000.0,"In the old west, a man becomes a Sheriff just for the pay, figuring he can decamp if things get tough. In the end, he uses ingenuity instead.","['Comédia', 'Faroeste']",0,0
498,Flor de Cacto,Cactus Flower,1969,104,['Gene Saks'],"['Abe Burrows', 'Pierre Barillet', 'Jean-Pierre Grédy']","['Walter Matthau', 'Ingrid Bergman', 'Goldie Hawn']",7.2,12000.0,"Um dentista finge ser casado para evitar compromissos, mas quando ele se apaixona por uma mulher, ele deve recrutar sua amada enfermeira para se fazer passar por sua esposa.","['Comédia', 'Romance']",0,0
499,O Cremador,Spalovac mrtvol,1969,95,['Juraj Herz'],"['Ladislav Fuks', 'Juraj Herz']","['Rudolf Hrusínský', 'Vlasta Chramostová', 'Jana Stehnová']",8.0,11000.0,"Na Segunda Guerra Mundial, um cremador demente acredita que a cremação alivia o sofrimento terreno e se propõe a salvar o mundo.","['Comédia', 'Policial', 'Drama', 'Terror', 'Mistério', 'Suspense']",0,0
500,Aristogatas,The AristoCats,1970,78,['Wolfgang Reitherman'],"['Larry Clemmons', 'Vance Gerry', 'Ken Anderson']","['Phil Harris', 'Eva Gabor', 'Sterling Holloway']",7.1,118000.0,"Quando uma milionária pretende deixar a sua fortuna para os gatos, estes tornam-se o alvo do ódio do mordomo, que quer ficar com tudo para si.","['Animação', 'Aventura', 'Comédia', 'Família', 'Musical']",4000000,35461460
501,"Patton, Rebelde ou Herói?",Patton,1970,172,['Franklin J. Schaffner'],"['Francis Ford Coppola', 'Edmund H. North', 'Ladislas Farago']","['George C. Scott', 'Karl Malden', 'Stephen Young']",7.9,110000.0,A fase da carreira do polêmico general americano George S. Patton na Segunda Guerra Mundial.,"['Biografia', 'Drama', 'Guerra']",12000000,61749765
502,M*A*S*H,MASH,1970,116,['Robert Altman'],"['Richard Hooker', 'Ring Lardner Jr.']","['Donald Sutherland', 'Elliott Gould', 'Tom Skerritt']",7.4,79000.0,O pessoal de um hospital de campo de guerra coreano usa o humor e a astúcia para manter a sanidade diante do horror da guerra.,"['Comédia', 'Drama', 'Guerra']",3500000,81600000
503,Os Guerreiros Pilantras,Kelly's Heroes,1970,144,['Brian G. Hutton'],['Troy Kennedy Martin'],"['Clint Eastwood', 'Telly Savalas', 'Don Rickles']",7.6,55000.0,Um grupo de soldados americanos se esgueira pelas linhas inimigas para chegar em um esconderijo secreto de tesouros nazistas.,"['Aventura', 'Comédia', 'Guerra']",4000000,5200000
504,De Volta ao Planeta dos Macacos,Beneath the Planet of the Apes,1970,95,['Ted Post'],"['Paul Dehn', 'Mort Abrahams', 'Pierre Boulle']","['James Franciscus', 'Kim Hunter', 'Maurice Evans']",6.0,55000.0,O único sobrevivente de uma missão de resgate interplanetário procura o único sobrevivente da expedição anterior. Descubra um planeta governado por macacos e uma cidade subterrânea administrada por seres humanos telepáticos.,"['Ação', 'Aventura', 'Ficção científica']",3000000,18999718
505,Cada um Vive como Quer,Five Easy Pieces,1970,98,['Bob Rafelson'],"['Carole Eastman', 'Bob Rafelson']","['Jack Nicholson', 'Karen Black', 'Billy Green Bush']",7.4,42000.0,Um músico brilhante entra em uma odisseia de autodescoberta.,['Drama'],0,0
506,O Pequeno Grande Homem,Little Big Man,1970,139,['Arthur Penn'],"['Thomas Berger', 'Calder Willingham']","['Dustin Hoffman', 'Faye Dunaway', 'Chief Dan George']",7.5,39000.0,"Jack Crabb, looking back from extreme old age, tells of his life being raised by Native Americans and fighting with General Custer.","['Aventura', 'Comédia', 'Drama', 'Faroeste']",15000000,31559552
507,Love Story: Uma História de Amor,Love Story,1970,100,['Arthur Hiller'],['Erich Segal'],"['Ali MacGraw', ""Ryan O'Neal"", 'John Marley']",6.9,38000.0,"Um menino e uma menina de diferentes origens se apaixonam, independentemente de sua educação e depois uma tragédia acontece.","['Drama', 'Romance']",2200000,106550690
508,Tora! Tora! Tora!,Tora! Tora! Tora!,1970,144,"['Richard Fleischer', 'Kinji Fukasaku', 'Toshio Masuda']","['Larry Forrester', 'Hideo Oguni', 'Ryûzô Kikushima']","['Martin Balsam', 'Sô Yamamura', 'Jason Robards']",7.5,38000.0,A história do ataque aéreo japonês de 1941 a Pearl Harbor e a série de erros americanos que antecederam e exacerbaram sua eficácia.,"['Ação', 'Drama', 'História', 'Guerra']",0,0
509,O Conformista,Il conformista,1970,113,['Bernardo Bertolucci'],"['Alberto Moravia', 'Bernardo Bertolucci']","['Jean-Louis Trintignant', 'Stefania Sandrelli', 'Gastone Moschin']",7.9,35000.0,"Um italiano de vontade fraca torna-se um lacaio fascista que vai ao exterior para organizar o assassinato de seu antigo professor, agora um dissidente político.",['Drama'],750000,649158
510,El Topo,El Topo,1970,125,['Alejandro Jodorowsky'],['Alejandro Jodorowsky'],"['Alejandro Jodorowsky', 'Brontis Jodorowsky', 'José Legarreta']",7.2,32000.0,"Um misterioso pistoleiro vestido de preto vagueia por uma paisagem mística ocidental, encontrando muitos personagens estranhos.","['Drama', 'Faroeste']",1000000,161267
511,Os Abutres Têm Fome,Two Mules for Sister Sara,1970,116,['Don Siegel'],"['Budd Boetticher', 'Albert Maltz']","['Clint Eastwood', 'Shirley MacLaine', 'Manolo Fábregas']",7.0,31000.0,"Sara está em fuga no México e Hogan, que se prepara para uma futura missão de captura de um forte francês, a salva dos vaqueiros. Os dois se tornam bons amigos, mas Sara nunca lhe conta o verdadeiro motivo pelo qual foi proibida.","['Aventura', 'Drama', 'Romance', 'Guerra', 'Faroeste']",2500000,5050000
512,O Círculo Vermelho,Le cercle rouge,1970,140,['Jean-Pierre Melville'],['Jean-Pierre Melville'],"['Alain Delon', 'Bourvil', 'Gian Maria Volontè']",7.9,30000.0,Um ladrão profissional recém saído da prisão junta forças com um condenado foragido e um ex-policial alcoólatra para tramar um elaborado plano de roubo de joias.,"['Policial', 'Drama', 'Suspense']",0,0
513,Ardil 22,Catch-22,1970,122,['Mike Nichols'],"['Joseph Heller', 'Buck Henry']","['Alan Arkin', 'Martin Balsam', 'Richard Benjamin']",7.1,27000.0,"Um homem está a tentar desesperadamente ser certificado de louco durante a Segunda Guerra Mundial, para que possa parar de voar em missões.","['Comédia', 'Drama', 'Guerra']",0,0
514,Trinity é o Meu Nome,Lo chiamavano Trinità...,1970,115,['Enzo Barboni'],"['Enzo Barboni', 'Gene Luotto']","['Terence Hill', 'Bud Spencer', 'Steffen Zacharias']",7.4,26000.0,"Um pistoleiro preguiçoso e pouco ortodoxo e seu irmão corpulento e ladrão de cavalos defendem um assentamento mórmon de um grande grileiro de terras, um bandido mexicano e seus capangas.","['Comédia', 'Faroeste']",0,0
515,O Pássaro das Plumas de Cristal,L'uccello dalle piume di cristallo,1970,96,['Dario Argento'],"['Dario Argento', 'Fredric Brown']","['Tony Musante', 'Suzy Kendall', 'Enrico Maria Salerno']",7.1,25000.0,"Um expatriado americano em Roma testemunha uma tentativa de assassinato. Mais tarde, descobre que está conectado a uma onda de assassinatos na cidade e decide fazer sua própria investigação, apesar de ser o objetivo pessoal do assassino.","['Terror', 'Mistério', 'Suspense']",0,0
516,Aeroporto,Airport,1970,137,"['George Seaton', 'Henry Hathaway']","['Arthur Hailey', 'George Seaton']","['Burt Lancaster', 'Dean Martin', 'George Kennedy']",6.6,23000.0,"Um bombardeiro a bordo de um avião, um aeroporto quase fechado pela neve e vários problemas pessoais das pessoas envolvidas.","['Ação', 'Drama', 'Suspense']",10000000,100489151
517,Hercules in New York,Hercules in New York,1970,92,['Arthur Allan Seidelman'],['Aubrey Wisberg'],"['Arnold Stang', 'Arnold Schwarzenegger', 'Deborah Loomis']",3.3,20000.0,Hércules é enviado para a Terra onde encontra o amor verdadeiro e começa uma carreira promissora no fisiculturismo.,"['Aventura', 'Comédia', 'Fantasia']",0,0
518,"Woodstock: 3 Dias de Paz, Amor e Música",Woodstock,1970,184,['Michael Wadleigh'],[],"['Joan Baez', 'Richie Havens', 'Roger Daltrey']",8.1,19000.0,A crônica do filme do lendário festival de música de 1969.,"['Documentário', 'História', 'Musical']",600000,321295
519,Zabriskie Point,Zabriskie Point,1970,113,['Michelangelo Antonioni'],"['Michelangelo Antonioni', 'Franco Rossetti', 'Sam Shepard']","['Mark Frechette', 'Daria Halprin', 'Paul Fix']",6.9,17000.0,"Numa época de agitação civil crónica no final dos anos 60, a América.",['Drama'],7000000,84879
520,Rio Lobo,Rio Lobo,1970,114,['Howard Hawks'],"['Burton Wohl', 'Leigh Brackett']","['John Wayne', 'Jorge Rivero', ""Jennifer O'Neill""]",6.7,14000.0,"Após a Guerra Civil, Cord McNally procura o traidor cuja traição levou à derrota de sua unidade guerreira e à perda de um amigo próximo.","['Drama', 'Guerra', 'Faroeste']",0,0
521,Investigação Sobre um Cidadão Acima de Qualquer Suspeita,Indagine su un cittadino al di sopra di ogni sospetto,1970,115,['Elio Petri'],"['Elio Petri', 'Ugo Pirro']","['Gian Maria Volontè', 'Florinda Bolkan', 'Gianni Santuccio']",8.0,14000.0,Um chefe de detetives da seção de homicídios mata seu amante e deixa deliberadamente pistas para provar sua própria responsabilidade pelo crime.,"['Policial', 'Drama']",0,0
522,A Vida Íntima de Sherlock Holmes,The Private Life of Sherlock Holmes,1970,125,['Billy Wilder'],"['Arthur Conan Doyle', 'Billy Wilder', 'I.A.L. Diamond']","['Robert Stephens', 'Christopher Lee', 'Colin Blakely']",7.0,14000.0,"Quando um entediado Holmes ansiosamente aceita o caso de Gabrielle Valladon, após um atentado contra sua vida, a busca pelo marido desaparecido o leva ao Lago Ness e ao monstro lendário.","['Aventura', 'Comédia', 'Policial', 'Mistério', 'Romance', 'Suspense']",10000000,19773
523,Waterloo,Waterloo,1970,134,['Sergey Bondarchuk'],"['H.A.L. Craig', 'Sergey Bondarchuk', 'Vittorio Bonicelli']","['Rod Steiger', 'Christopher Plummer', 'Orson Welles']",7.3,13000.0,"Vendo o declínio de tudo aquilo pelo trabalhou para obter, o conquistador Napoleão Bonaparte e o seu exército confrontam-se com o exército Britânico, na Batalha de Waterloo.","['Ação', 'Biografia', 'Drama', 'História', 'Guerra']",0,0
524,Gimme Shelter,Gimme Shelter,1970,91,"['Albert Maysles', 'David Maysles', 'Charlotte Zwerin']",[],"['Mick Jagger', 'Keith Richards', 'Mick Taylor']",7.8,13000.0,"When three hundred thousand members of the Love Generation collided with a few dozen Hells Angels at San Francisco's Altamont Speedway, the bloody slash that transformed a decade's dreams into disillusionment was immortalized on this film.","['Documentário', 'Musical', 'Suspense']",0,0
525,Laranja Mecânica,A Clockwork Orange,1971,136,['Stanley Kubrick'],"['Stanley Kubrick', 'Anthony Burgess']","['Malcolm McDowell', 'Patrick Magee', 'Michael Bates']",8.2,898000.0,"No futuro, um jovem líder de gang é levado para prisão e decide ser voluntário em um experimento, mas os resultados não são os esperados.","['Policial', 'Ficção científica']",2200000,27034174
526,A Fantástica Fábrica de Chocolate,Willy Wonka & the Chocolate Factory,1971,100,['Mel Stuart'],"['Roald Dahl', 'Robert Kaufman', 'David Seltzer']","['Gene Wilder', 'Jack Albertson', 'Peter Ostrum']",7.8,233000.0,"Um menino pobre, mas esperançoso, encontra um dos cinco bilhetes dourados que lhe permitirá visitar a fábrica de chocolate de Willy Wonka.","['Aventura', 'Comédia', 'Família', 'Fantasia', 'Musical']",3000000,670213
527,Perseguidor Implacável,Dirty Harry,1971,102,"['Don Siegel', 'Clint Eastwood']","['Harry Julian Fink', 'Rita M. Fink', 'Dean Riesner']","['Clint Eastwood', 'Andrew Robinson', 'Harry Guardino']",7.7,172000.0,"Quando um louco que se autodenomina ""o assassino do Escorpião"" ameaça a cidade, o inspetor de polícia de São Francisco, Harry Callahan, é encarregado de localizar e descobrir o psicopata enlouquecido.","['Ação', 'Policial', 'Suspense']",4000000,35988495
528,Operação França,The French Connection,1971,104,['William Friedkin'],"['Ernest Tidyman', 'Robin Moore', 'William Friedkin']","['Gene Hackman', 'Roy Scheider', 'Fernando Rey']",7.7,139000.0,Dois policiais do Bureau de Narcóticos de Nova York se deparam com um trabalho de contrabandista de drogas com conexões na França.,"['Ação', 'Policial', 'Drama', 'Suspense']",1800000,51702099
529,007 - Os Diamantes São Eternos,Diamonds Are Forever,0,0,['Guy Hamilton'],"['Richard Maibaum', 'Tom Mankiewicz', 'Ian Fleming']","['Sean Connery', 'Jill St. John', 'Charles Gray']",6.5,117000.0,"Ao investigar actividades misteriosas no mercado de diamantes, Bond descobre que a SPECTRE está a desviar pedras para usar num mortífero satélite. Com a ajuda de Tiffany Case, ele vai enfrentar o perigo com o destino do mundo nas mãos.","['Ação', 'Aventura', 'Suspense']",7200000,43830091
530,Ensina-me a Viver,Harold and Maude,1971,91,['Hal Ashby'],['Colin Higgins'],"['Ruth Gordon', 'Bud Cort', 'Vivian Pickles']",7.9,83000.0,"Jovem, rico e obcecado pela morte, Harold muda para sempre quando conhece a septuagenária Maude em um funeral.","['Comédia', 'Drama', 'Romance']",1200000,3978
531,Sob o Domínio do Medo,Straw Dogs,1971,113,['Sam Peckinpah'],"['David Zelag Goodman', 'Sam Peckinpah', 'Gordon Williams']","['Dustin Hoffman', 'Susan George', 'Peter Vaughan']",7.4,66000.0,Um jovem americano e sua esposa inglesa vão para uma zona rural da Inglaterra e enfrentam assédio local cada vez mais cruel.,"['Policial', 'Drama', 'Suspense']",0,0
532,THX 1138,THX 1138,1971,86,['George Lucas'],"['George Lucas', 'Walter Murch']","['Robert Duvall', 'Donald Pleasence', 'Don Pedro Colley']",6.6,56000.0,"No século vinte e cinco, uma época em que as pessoas têm designações em vez de nomes, um homem e uma mulher se rebelam contra sua sociedade rigidamente controlada.","['Drama', 'Ficção científica', 'Suspense']",777000,2437000
533,A Última Sessão de Cinema,The Last Picture Show,1971,118,['Peter Bogdanovich'],"['Larry McMurtry', 'Peter Bogdanovich']","['Timothy Bottoms', 'Jeff Bridges', 'Cybill Shepherd']",8.0,54000.0,"Em 1951, um grupo de estudantes do ensino médio chegou à idade adulta em uma cidade desolada, isolada e atrofiada no norte do Texas que está morrendo lentamente, tanto cultural como economicamente.","['Drama', 'Romance']",1300000,29146255
534,Um Violinista no Telhado,Fiddler on the Roof,1971,181,['Norman Jewison'],"['Sholom Aleichem', 'Arnold Perl', 'Joseph Stein']","['Topol', 'Norma Crane', 'Leonard Frey']",8.0,49000.0,"Na Rússia pré-revolucionária, um camponês judeu tenta fazer com que três de suas filhas se casem enquanto um sentimento anti-semita crescente ameaça sua aldeia.","['Drama', 'Família', 'Musical', 'Romance']",9000000,10407120
535,Fuga do Planeta dos Macacos,Escape from the Planet of the Apes,1971,98,['Don Taylor'],"['Paul Dehn', 'Pierre Boulle']","['Roddy McDowall', 'Kim Hunter', 'Bradford Dillman']",6.3,42000.0,"Dois cientistas símios, Corneliuse Zira - na verdade havia mais um, Milo, que morreu acidentalmente - retornam no tempo e chegam no século XX, em Los Angeles. Quando eles revelam sua habilidade para falar primeiramente são tratados bem.","['Ação', 'Ficção científica']",2500000,12348905
536,Se Minha Cama Voasse,Bedknobs and Broomsticks,1971,117,"['Robert Stevenson', 'Ward Kimball']","['Ralph Wright', 'Ted Berman', 'Bill Walsh']","['Angela Lansbury', 'David Tomlinson', 'Roddy McDowall']",7.1,41000.0,"Um aprendiz de bruxo, três filhos e um mágico vigarista procuram o componente perdido de um feitiço mágico que será usado na defesa da Grã-Bretanha na Segunda Guerra Mundial.","['Animação', 'Aventura', 'Comédia', 'Família', 'Fantasia', 'Musical']",20000000,844
537,O Enigma de Andrômeda,The Andromeda Strain,1971,131,['Robert Wise'],"['Michael Crichton', 'Nelson Gidding']","['James Olson', 'Arthur Hill', 'David Wayne']",7.2,41000.0,Uma equipe de cientistas de primeiro nível trabalha em um laboratório secreto de última geração para descobrir o que matou os cidadãos de uma pequena cidade e aprender como este contágio mortal pode ser interrompido.,"['Mistério', 'Ficção científica', 'Suspense']",6500000,411
538,Quando Explode a Vingança,Giù la testa,1971,157,['Sergio Leone'],"['Sergio Leone', 'Sergio Donati', 'Luciano Vincenzoni']","['Rod Steiger', 'James Coburn', 'Romolo Valli']",7.6,39000.0,"Um bandido de vida ruim e um especialista em explosivos, se rebelam contra o governo e se tornam heróis da Revolução Mexicana.","['Drama', 'Guerra', 'Faroeste']",0,0
539,Bananas,Bananas,1971,82,['Woody Allen'],"['Woody Allen', 'Mickey Rose']","['Woody Allen', 'Louise Lasser', 'Carlos Montalbán']",6.9,39000.0,"Quando um nova-iorquino desajeitado é largado por sua namorada ativista, ele viaja para uma pequena nação latino-americana e se envolve em sua mais recente rebelião.",['Comédia'],2000000,136200
540,"Carter, o Vingador",Get Carter,1971,112,['Mike Hodges'],"['Mike Hodges', 'Ted Lewis']","['Michael Caine', 'Ian Hendry', 'Britt Ekland']",7.3,38000.0,"Quando seu irmão morre em circunstâncias misteriosas em um acidente de carro, o gangster londrino Jack Carter viaja para Newcastle para investigar.","['Ação', 'Policial', 'Suspense']",0,0
541,Anand,Anand,1971,122,['Hrishikesh Mukherjee'],"['Hrishikesh Mukherjee', 'Gulzar', 'D.N. Mukherjee']","['Rajesh Khanna', 'Amitabh Bachchan', 'Sumita Sanyal']",8.1,36000.0,"The story of a terminally ill man who wishes to live life to the fullest before the inevitable occurs, as told by his best friend.","['Drama', 'Musical']",0,0
542,A Última Esperança da Terra,The Omega Man,1971,98,['Boris Sagal'],"['John William Corrington', 'Joyce Hooper Corrington', 'Richard Matheson']","['Charlton Heston', 'Anthony Zerbe', 'Rosalind Cash']",6.4,35000.0,"A guerra biológica dizimou a vida na Terra. Los Angeles é uma cidade fantasma desolada, onde Robert Neville dirige seu conversível pelas ruas iluminadas pelo sol em busca de suprimentos.","['Ação', 'Drama', 'Ficção científica', 'Suspense']",0,0
543,Perversa Paixão,Play Misty for Me,1971,102,['Clint Eastwood'],"['Jo Heims', 'Dean Riesner']","['Clint Eastwood', 'Jessica Walter', 'Donna Mills']",6.9,33000.0,A vida de um disc-jockey vira de cabeça para baixo após um encontro romântico com um fã obcecado.,"['Drama', 'Suspense']",725000,10600000
544,E Agora para Algo Completamente Diferente,And Now for Something Completely Different,1971,88,['Ian MacNaughton'],"['Graham Chapman', 'John Cleese', 'Terry Gilliam']","['John Cleese', 'Michael Palin', 'Graham Chapman']",7.5,32000.0,An anthology of the best sketches from the first and second seasons of Monty Python's Flying Circus (1969).,['Comédia'],100000,6979
545,"Klute, O Passado Condena",Klute,1971,114,['Alan J. Pakula'],"['Andy Lewis', 'David E. Lewis']","['Jane Fonda', 'Donald Sutherland', 'Charles Cioffi']",7.1,31000.0,Um detetive de uma pequena cidade em busca de um homem desaparecido tem apenas uma pista: uma conexão com uma prostituta nova-iorquina.,"['Policial', 'Mistério', 'Suspense']",2500000,34741
546,Corrida Contra o Destino,Vanishing Point,1971,99,['Richard C. Sarafian'],"['Guillermo Cabrera Infante', 'Malcolm Hart', 'Barry Hall']","['Barry Newman', 'Cleavon Little', 'Charlotte Rampling']",7.2,31000.0,"Um ex-fuzileiro, ex-corredor automobilístico e ex-policial demitido da corporação, dedica-se a transportar carros para uma pequena oficina. Em um desses trabalhos ele deve levar um Dodge Challenger '70 de Denver para São Francisco.","['Ação', 'Policial', 'Suspense']",1585000,12443192
547,O Dragão Chinês,Tang shan da xiong,1971,100,"['Wei Lo', 'Chia-Hsiang Wu']",['Wei Lo'],"['Bruce Lee', 'Maria Yi', 'James Tien']",6.9,30000.0,Um jovem sob juramento de não cometer atos de violência trabalha com seus primos em uma fábrica de gelo onde eles começam misteriosamente a desaparecer.,"['Ação', 'Policial', 'Drama', 'Suspense']",0,0
548,Onde os Homens São Homens,McCabe & Mrs. Miller,0,0,['Robert Altman'],"['Edmund Naughton', 'Robert Altman', 'Brian McKay']","['Warren Beatty', 'Julie Christie', 'Rene Auberjonois']",7.6,28000.0,"Um jogador e uma prostituta tornam-se parceiros de negócios em uma remota cidade mineira do Velho Oeste, e sua empresa prospera até que uma grande corporação entra em cena.","['Drama', 'Faroeste']",0,0
